{"$defs":{"BinaryWireV1":{"additionalProperties":false,"properties":{"byte_length":{"format":"uint64","minimum":0,"type":"integer"},"data":{"type":"string"},"encoding":{"type":"string"}},"required":["encoding","data","byte_length"],"type":"object"},"ExactnessWireV1":{"oneOf":[{"additionalProperties":false,"properties":{"kind":{"const":"source_exact","type":"string"}},"required":["kind"],"type":"object"},{"additionalProperties":false,"properties":{"kind":{"const":"post_policy","type":"string"},"policy_digest":{"type":"string"},"transformation_receipt_id":{"type":"string"}},"required":["kind","policy_digest","transformation_receipt_id"],"type":"object"}]},"ExpandedEventWireV1":{"additionalProperties":false,"properties":{"acquisition_sequence":{"format":"uint64","minimum":0,"type":"integer"},"event_id":{"type":"string"},"exact_bytes":{"$ref":"#/$defs/BinaryWireV1"},"exactness":{"$ref":"#/$defs/ExactnessWireV1"},"lane_sequence":{"format":"uint64","minimum":0,"type":"integer"},"record_state":{"type":"string"}},"required":["event_id","exactness","acquisition_sequence","lane_sequence","record_state","exact_bytes"],"type":"object"}},"$id":"schemas/evidentrail/v1/expansion_response.schema.json","$schema":"https://json-schema.org/draft/2020-12/schema","additionalProperties":false,"properties":{"contract":{"const":"evidentrail.expansion_response","type":"string"},"contract_version":{"const":1,"format":"uint16","maximum":9007199254740991,"minimum":0,"type":"integer"},"events":{"items":{"$ref":"#/$defs/ExpandedEventWireV1"},"maxItems":4096,"type":"array"},"evidence_reference_id":{"pattern":"^eref_[0-9a-f]{64}$","type":"string"},"relation":{"type":"string"},"result_id":{"pattern":"^result_[0-9a-f]{64}$","type":"string"},"returned_bytes":{"format":"uint64","maximum":9007199254740991,"minimum":0,"type":"integer"},"truncated":{"type":"boolean"}},"required":["contract","contract_version","result_id","evidence_reference_id","relation","events","returned_bytes","truncated"],"title":"evidentrail.expansion_response","type":"object"}