{"contract":"evidentrail.expansion_response","contract_version":1,"events":[],"evidence_reference_id":"eref_0000000000000000000000000000000000000000000000000000000000000000","relation":"exact","result_id":"result_0000000000000000000000000000000000000000000000000000000000000000","returned_bytes":0,"truncated":false}